[
  {
    "scenario_id": "scn-customer-triage",
    "project_id": "prj-support",
    "name": "Customer triage",
    "trigger_id": "trg-support-webhook",
    "revision": 1,
    "agent": {
      "agent_id": "agt-customer-triage",
      "version": 2
    },
    "output_binding": {
      "kind": "slack_message",
      "target": {
        "channel_ref": "slack://workspace/T123/channel/C456"
      }
    },
    "layout": {
      "node_positions": {
        "trigger": {
          "x": 0,
          "y": 120
        },
        "agent": {
          "x": 360,
          "y": 120
        },
        "output": {
          "x": 720,
          "y": 120
        }
      }
    },
    "created_at": "2026-07-01T18:05:00Z",
    "updated_at": "2026-07-01T18:05:00Z"
  },
  {
    "scenario_id": "scn-display-in-app",
    "project_id": "prj-support",
    "name": "Display in app",
    "trigger_id": "trg-support-webhook",
    "revision": 1,
    "agent": {
      "agent_id": "agt-customer-triage",
      "version": 2
    },
    "output_binding": {
      "kind": "display_in_app"
    },
    "layout": {
      "node_positions": {
        "trigger": {
          "x": 0,
          "y": 120
        },
        "agent": {
          "x": 360,
          "y": 120
        },
        "output": {
          "x": 720,
          "y": 120
        }
      }
    },
    "created_at": "2026-07-01T18:05:00Z",
    "updated_at": "2026-07-01T18:05:00Z"
  },
  {
    "scenario_id": "scn-webhook-output",
    "project_id": "prj-support",
    "name": "Webhook output",
    "trigger_id": "trg-support-webhook",
    "revision": 1,
    "agent": {
      "agent_id": "agt-customer-triage",
      "version": 2
    },
    "output_binding": {
      "kind": "webhook",
      "target": {
        "endpoint_ref": "webhook://project/prj-support/endpoint/case-updates"
      }
    },
    "layout": {
      "node_positions": {
        "trigger": {
          "x": 0,
          "y": 120
        },
        "agent": {
          "x": 360,
          "y": 120
        },
        "output": {
          "x": 720,
          "y": 120
        }
      }
    },
    "created_at": "2026-07-01T18:05:00Z",
    "updated_at": "2026-07-01T18:05:00Z"
  },
  {
    "scenario_id": "scn-file-logical-output",
    "project_id": "prj-support",
    "name": "Deliver generated case brief",
    "trigger_id": "trg-support-webhook",
    "revision": 1,
    "agent": {
      "agent_id": "agt-customer-triage",
      "version": 2
    },
    "output_binding": {
      "kind": "file",
      "selector": {
        "selector_type": "logical_output",
        "logical_output_name": "case_brief"
      },
      "required_kind": "document",
      "allowed_mime_types": ["application/pdf"],
      "required_custody": "ordinary",
      "destination_connection_ref": "connection-support-export",
      "mode": "attachment",
      "delivery_policy": {
        "max_size_bytes": 10485760,
        "authorization_ttl_seconds": 900,
        "max_attempts": 3,
        "initial_retry_delay_seconds": 5
      },
      "private_export_authorization_required": false,
      "idempotency_key_template": "{scenario_revision}:{invocation_id}:{artifact_id}:{destination_revision}"
    },
    "layout": {
      "node_positions": {
        "output": {"x": 720, "y": 120}
      }
    },
    "created_at": "2026-08-09T00:00:00Z",
    "updated_at": "2026-08-09T00:00:00Z"
  },
  {
    "scenario_id": "scn-file-explicit-selection",
    "project_id": "prj-support",
    "name": "Expose selected vault image",
    "trigger_id": "trg-support-webhook",
    "revision": 1,
    "agent": {
      "agent_id": "agt-customer-triage",
      "version": 2
    },
    "output_binding": {
      "kind": "file",
      "selector": {
        "selector_type": "explicit_selection",
        "selection_rule_ref": "final_customer_artifact"
      },
      "required_kind": "image",
      "allowed_mime_types": ["image/png", "image/jpeg"],
      "required_custody": "vault_private",
      "destination_connection_ref": "connection-customer-vault",
      "mode": "vault_retrieval",
      "delivery_policy": {
        "max_size_bytes": 52428800,
        "authorization_ttl_seconds": 600,
        "max_attempts": 2,
        "initial_retry_delay_seconds": 3
      },
      "private_export_authorization_required": false,
      "idempotency_key_template": "{scenario_revision}:{invocation_id}:{artifact_id}:{destination_revision}"
    },
    "layout": {
      "node_positions": {
        "output": {"x": 720, "y": 120}
      }
    },
    "created_at": "2026-08-09T00:00:00Z",
    "updated_at": "2026-08-09T00:00:00Z"
  }
]
